ShortName,OfficialName,ISO3,ISO2,UNI,UNDP,FAOSTAT,GAUL
Afghanistan,The Islamic Republic of Afghanistan,AFG,AF,4,AFG,2,1
Albania,the Republic of Albania,ALB,AL,8,ALB,3,3
Algeria,the People's Democratic Republic of Algeria,DZA,DZ,12,ALG,4,4
Andorra,the Principality of Andorra,AND,AD,20,AND,6,7
Angola,the Republic of Angola,AGO,AO,24,ANG,7,8
Antigua and Barbuda,Antigua and Barbuda,ATG,AG,28,ANT,8,11
Argentina,the Argentine Republic,ARG,AR,32,ARG,9,12
Armenia,the Republic of Armenia,ARM,AM,51,ARM,1,13
Australia,Australia,AUS,AU,36,AUL,10,17
Austria,the Republic of Austria,AUT,AT,40,AUS,11,18
Azerbaijan,the Republic of Azerbaijan,AZE,AZ,31,AZE,52,19
Bahamas,the Commonwealth of the Bahamas,BHS,BS,44,BHA,12,20
Bahrain,the Kingdom of Bahrain,BHR,BH,48,BAH,13,21
Bangladesh,the People's Republic of Bangladesh,BGD,BD,50,BGD,16,23
Barbados,Barbados,BRB,BB,52,BAR,14,24
Belarus,the Republic of Belarus,BLR,BY,112,BYE,57,26
Belgium,the Kingdom of Belgium,BEL,BE,56,BEL,255,27
Belize,Belize,BLZ,BZ,84,BZE,23,28
Benin,the Republic of Benin,BEN,BJ,204,BEN,53,29
Bhutan,the Kingdom of Bhutan,BTN,BT,64,BHU,18,31
Bolivia (Plurinational State of),the Plurinational State of Bolivia,BOL,BO,68,BOL,19,33
Bosnia and Herzegovina,Bosnia and Herzegovina,BIH,BA,70,BIH,80,34
Botswana,the Republic of Botswana,BWA,BW,72,BOT,20,35
Brazil,the Federative Republic of Brazil,BRA,BR,76,BRA,21,37
Brunei Darussalam,Brunei Darussalam,BRN,BN,96,BRU,26,40
Bulgaria,the Republic of Bulgaria,BGR,BG,100,BUL,27,41
Burkina Faso,Burkina Faso,BFA,BF,854,BKF,233,42
Burundi,the Republic of Burundi,BDI,BI,108,BDI,29,43
Cambodia,the Kingdom of Cambodia,KHM,KH,116,CMB,115,44
Cameroon,the Republic of Cameroon,CMR,CM,120,CMR,32,45
Canada,Canada,CAN,CA,124,CAN,33,46
Cabo Verde,Republic of Cabo Verde,CPV,CV,132,CVI,35,47
Central African Republic,the Central African Republic,CAF,CF,140,CAF,37,49
Chad,the Republic of Chad,TCD,TD,148,CHD,39,50
Chile,the Republic of Chile,CHL,CL,152,CHI,40,51
China,the People's Republic of China,CHN,CN,156,CPR,351,53
Colombia,the Republic of Colombia,COL,CO,170,COL,44,57
Comoros,the Union of the Comoros,COM,KM,174,COI,45,58
Congo,the Republic of the Congo,COG,CG,178,PRC,46,59
Cook Islands,the Cook Islands,COK,CK,184,CKI,47,60
Costa Rica,the Republic of Costa Rica,CRI,CR,188,COS,48,61
Côte d'Ivoire,the Republic of Côte d'Ivoire,CIV,CI,384,IVC,107,66
Croatia,the Republic of Croatia,HRV,HR,191,CRO,98,62
Cuba,the Republic of Cuba,CUB,CU,192,CUB,49,63
Cyprus,the Republic of Cyprus,CYP,CY,196,CYP,50,64
Czech Republic,the Czech Republic,CZE,CZ,203,CEH,167,65
Democratic People's Republic of Korea,the Democratic People's Republic of Korea,PRK,KP,408,DRK,116,67
Denmark,the Kingdom of Denmark,DNK,DK,208,DEN,54,69
Democratic Republic of the Congo,the Democratic Republic of the Congo,COD,CD,180,ZAI,250,68
Djibouti,the Republic of Djibouti,DJI,DJ,262,DJI,72,70
Dominica,the Commonwealth of Dominica,DMA,DM,212,DMI,55,71
Dominican Republic,the Dominican Republic,DOM,DO,214,DOM,56,72
Ecuador,the Republic of Ecuador,ECU,EC,218,ECU,58,73
Egypt,the Arab Republic of Egypt,EGY,EG,818,EGY,59,40765
El Salvador,the Republic of El Salvador,SLV,SV,222,ELS,60,75
Equatorial Guinea,the Republic of Equatorial Guinea,GNQ,GQ,226,EQG,61,76
Eritrea,the State of Eritrea,ERI,ER,232,ERI,178,77
Estonia,the Republic of Estonia,EST,EE,233,EST,63,78
Ethiopia,the Federal Democratic Republic of Ethiopia,ETH,ET,231,ETH,238,79
Fiji,the Republic of Fiji,FJI,FJ,242,FIJ,66,83
Finland,the Republic of Finland,FIN,FI,246,FIN,67,84
France,the French Republic,FRA,FR,250,FRA,68,85
Gabon,the Gabonese Republic,GAB,GA,266,GAB,74,89
Gambia,the Republic of the Gambia,GMB,GM,270,GAM,75,90
Georgia,Georgia,GEO,GE,268,GEO,73,92
Germany,the Federal Republic of Germany,DEU,DE,276,GER,79,93
Ghana,the Republic of Ghana,GHA,GH,288,GHA,81,94
Greece,the Hellenic Republic,GRC,GR,300,GRE,84,97
Grenada,Grenada,GRD,GD,308,GRN,86,99
Guatemala,the Republic of Guatemala,GTM,GT,320,GUA,89,103
Guinea,the Republic of Guinea,GIN,GN,324,GUI,90,106
Guinea-Bissau,the Republic of Guinea-Bissau,GNB,GW,624,GBS,175,105
Guyana,the Republic of Guyana,GUY,GY,328,GUY,91,107
Haiti,the Republic of Haiti,HTI,HT,332,HAI,93,108
Honduras,the Republic of Honduras,HND,HN,340,HON,95,111
Hungary,Hungary,HUN,HU,348,HUN,97,113
Iceland,the Republic of Iceland,ISL,IS,352,ICE,99,114
India,the Republic of India,IND,IN,356,IND,100,115
Indonesia,the Republic of Indonesia,IDN,ID,360,INS,101,116
Iran (Islamic Republic of),the Islamic Republic of Iran,IRN,IR,364,IRA,102,117
Iraq,the Republic of Iraq,IRQ,IQ,368,IRQ,103,118
Ireland,Ireland,IRL,IE,372,IRE,104,119
Israel,the State of Israel,ISR,IL,376,ISR,105,121
Italy,the Republic of Italy,ITA,IT,380,ITA,106,122
Jamaica,Jamaica,JAM,JM,388,JAM,109,123
Japan,Japan,JPN,JP,392,JPN,110,126
Jordan,the Hashemite Kingdom of Jordan,JOR,JO,400,JOR,112,130
Kazakhstan,the Republic of Kazakhstan,KAZ,KZ,398,KAZ,108,132
Kenya,the Republic of Kenya,KEN,KE,404,KEN,114,133
Kiribati,the Republic of Kiribati,KIR,KI,296,KIR,83,135
Kuwait,the State of Kuwait,KWT,KW,414,KUW,118,137
Kyrgyzstan,the Kyrgyz Republic,KGZ,KG,417,KYR,113,138
Lao People's Democratic Republic,the Lao People's Democratic Republic,LAO,LA,418,LAO,120,139
Latvia,the Republic of Latvia,LVA,LV,428,LAT,119,140
Lebanon,the Lebanese Republic,LBN,LB,422,LEB,121,141
Lesotho,the Kingdom of Lesotho,LSO,LS,426,LES,122,142
Liberia,the Republic of Liberia,LBR,LR,430,LIR,123,144
Libya,Libya,LBY,LY,434,LIB,124,145
Lithuania,the Republic of Lithuania,LTU,LT,440,LIT,126,147
Luxembourg,the Grand Duchy of Luxembourg,LUX,LU,442,LUX,256,148
Madagascar,the Republic of Madagascar,MDG,MG,450,MAG,129,150
Malaysia,Malaysia,MYS,MY,458,MAL,131,153
Maldives,the Republic of Maldives,MDV,MV,462,MDV,132,154
Malta,the Republic of Malta,MLT,MT,470,MAT,134,156
Marshall Islands,the Republic of the Marshall Islands,MHL,MH,584,MAS,127,157
Malawi,the Republic of Malawi,MWI,MW,454,MLW,130,152
Mauritania,the Islamic Republic of Mauritania,MRT,MR,478,MAU,136,159
Mali,the Republic of Mali,MLI,ML,466,MLI,133,155
Mauritius,the Republic of Mauritius,MUS,MU,480,MAR,137,160
Mexico,the United Mexican States,MEX,MX,484,MEX,138,162
Micronesia (Federated States of),the Federated States of Micronesia,FSM,FM,583,MIC,145,163
Monaco,the Principality of Monaco,MCO,MC,492,MNC,140,166
Mongolia,Mongolia,MNG,MN,496,MON,141,167
Montenegro,Montenegro,MNE,ME,499,,273,2647
Morocco,the Kingdom of Morocco,MAR,MA,504,MOR,143,169
Mozambique,the Republic of Mozambique,MOZ,MZ,508,MOZ,144,170
Myanmar,the Republic of the Union of Myanmar,MMR,MM,104,MYA,28,171
Namibia,the Republic of Namibia,NAM,NA,516,NAM,147,172
Nauru,the Republic of Nauru,NRU,NR,520,NAU,148,173
Nepal,the Federal Democratic Republic of Nepal,NPL,NP,524,NEP,149,175
Netherlands,the Kingdom of the Netherlands,NLD,NL,528,NET,150,177
New Zealand,New Zealand,NZL,NZ,554,NZE,156,179
Nicaragua,the Republic of Nicaragua,NIC,NI,558,NIC,157,180
Niger,the Republic of the Niger,NER,NE,562,NER,158,181
Nigeria,the Federal Republic of Nigeria,NGA,NG,566,NIR,159,182
Niue,Niue,NIU,NU,570,NIU,160,183
Norway,the Kingdom of Norway,NOR,NO,578,NOR,162,186
Oman,the Sultanate of Oman,OMN,OM,512,OMA,221,187
Pakistan,the Islamic Republic of Pakistan,PAK,PK,586,PAK,165,188
Palau,the Republic of Palau,PLW,PW,585,TTP,180,189
Panama,the Republic of Panama,PAN,PA,591,PAN,166,191
Papua New Guinea,Independent State of Papua New Guinea,PNG,PG,598,PNG,168,192
Paraguay,the Republic of Paraguay,PRY,PY,600,PAR,169,194
Peru,the Republic of Peru,PER,PE,604,PER,170,195
Philippines,the Republic of the Philippines,PHL,PH,608,PHI,171,196
Poland,the Republic of Poland,POL,PL,616,POL,173,198
Portugal,the Portuguese Republic,PRT,PT,620,POR,174,199
Qatar,the State of Qatar,QAT,QA,634,QAT,179,201
Republic of Korea,the Republic of Korea,KOR,KR,410,ROK,117,202
Republic of Moldova,the Republic of Moldova,MDA,MD,498,MOL,146,165
Romania,Romania,ROU,RO,642,ROM,183,203
Russian Federation,the Russian Federation,RUS,RU,643,RUS,185,204
Rwanda,the Republic of Rwanda,RWA,RW,646,RWA,184,205
Saint Kitts and Nevis,Saint Kitts and Nevis,KNA,KN,659,STK,188,208
Saint Lucia,Saint Lucia,LCA,LC,662,STL,189,209
Saint Vincent and the Grenadines,Saint Vincent and the Grenadines,VCT,VC,670,STV,191,211
Samoa,the Independent State of Samoa,WSM,WS,882,SAM,244,212
San Marino,the Republic of San Marino,SMR,SM,674,SNM,192,213
Sao Tome and Principe,the Democratic Republic of Sao Tome and Principe,STP,ST,678,STP,193,214
Saudi Arabia,the Kingdom of Saudi Arabia,SAU,SA,682,SAU,194,215
Senegal,the Republic of Senegal,SEN,SN,686,SEN,195,217
Serbia,the Republic of Serbia,SRB,RS,688,,272,2648
Seychelles,the Republic of Seychelles,SYC,SC,690,SEY,196,220
Sierra Leone,the Republic of Sierra Leone,SLE,SL,694,SIL,197,221
Singapore,the Republic of Singapore,SGP,SG,702,SIN,200,222
Slovakia,the Slovak Republic,SVK,SK,703,SLO,199,223
Slovenia,the Republic of Slovenia,SVN,SI,705,SVN,198,224
Solomon Islands,Solomon Islands,SLB,SB,90,SOI,25,225
Somalia,the Federal Republic of Somalia,SOM,SO,706,SOM,201,226
South Africa,the Republic of South Africa,ZAF,ZA,710,SAF,202,227
South Sudan,the Republic of South Sudan,SSD,SS,728,,277,74
Spain,the Kingdom of Spain,ESP,ES,724,SPA,203,229
Sri Lanka,the Democratic Socialist Republic of Sri Lanka,LKA,LK,144,SRL,38,231
Sudan,the Republic of the Sudan,SDN,SD,729,SUD,276,40764
Suriname,the Republic of Suriname,SUR,SR,740,SUR,207,233
Swaziland,the Kingdom of Swaziland,SWZ,SZ,748,SWA,209,235
Sweden,the Kingdom of Sweden,SWE,SE,752,SWE,210,236
Switzerland,the Swiss Confederation,CHE,CH,756,SWI,211,237
Syrian Arab Republic,the Syrian Arab Republic,SYR,SY,760,SYR,212,238
Tajikistan,the Republic of Tajikistan,TJK,TJ,762,TAJ,208,239
Thailand,the Kingdom of Thailand,THA,TH,764,THA,216,240
The former Yugoslav Republic of Macedonia,The former Yugoslav Republic of Macedonia,MKD,MK,807,MKD,154,241
Timor-Leste,the Democratic Republic of Timor-Leste,TLS,TL,626,TIM,176,242
Togo,the Togolese Republic,TGO,TG,768,TOG,217,243
Tonga,the Kingdom of Tonga,TON,TO,776,TON,219,245
Trinidad and Tobago,the Republic of Trinidad and Tobago,TTO,TT,780,TRI,220,246
Tunisia,the Republic of Tunisia,TUN,TN,788,TUN,222,248
Turkey,the Republic of Turkey,TUR,TR,792,TUR,223,249
Turkmenistan,Turkmenistan,TKM,TM,795,TUK,213,250
Tuvalu,Tuvalu,TUV,TV,798,TUV,227,252
Uganda,the Republic of Uganda,UGA,UG,800,UGA,226,253
Ukraine,Ukraine,UKR,UA,804,UKR,230,254
United Arab Emirates,the United Arab Emirates,ARE,AE,784,UAE,225,255
United Kingdom,the United Kingdom of Great Britain and Northern Ireland,GBR,GB,826,UKM,229,256
United Republic of Tanzania,the United Republic of Tanzania,TZA,TZ,834,URT,215,257
United States of America,the United States of America,USA,US,840,USA,231,259
Uruguay,the Eastern Republic of Uruguay,URY,UY,858,URU,234,260
Uzbekistan,the Republic of Uzbekistan,UZB,UZ,860,UZB,235,261
Vanuatu,the Republic of Vanuatu,VUT,VU,548,VAN,155,262
Venezuela (Bolivarian Republic of),the Bolivarian Republic of Venezuela,VEN,VE,862,VEN,236,263
Viet Nam,the Socialist Republic of Viet Nam,VNM,VN,704,VIE,237,264
Yemen,the Republic of Yemen,YEM,YE,887,YEM,249,269
Zambia,the Republic of Zambia,ZMB,ZM,894,ZAM,251,270
Zimbabwe,the Republic of Zimbabwe,ZWE,ZW,716,ZIM,181,271
